keyword,title,channel,url,idea
株式,あの新中計で還元強化した世界トップ株じわじわずっと上がっています,ゆるっとひげ株投資,https://www.youtube.com/watch?v=gVlifdjAj8s,✅ あり → 20260329_051929_gVlifdjAj8s.md
株式,３月株式分割でついにあの優良株に手が届く！注目の３銘柄はコレです,ひげづらの株式研究所,https://www.youtube.com/watch?v=Mj_b0kORvPo,✅ あり → 20260329_052020_Mj_b0kORvPo.md
株式,まだ株価上昇が狙えそうな財務健全＋利回り4 4％株,ゆるっとひげ株投資,https://www.youtube.com/watch?v=mOBtl8Hm54c,✅ あり → 20260329_052144_mOBtl8Hm54c.md
株式,株価40％暴落中の任天堂は今すぐ買うべきなのか私の結論はコレです,ひげ株おじさんの投資チャンネル,https://www.youtube.com/watch?v=hZZl37PgxgA,✅ あり → 20260329_052228_hZZl37PgxgA.md
株式,テスラ株360ドル台へ下落…だが戦略は加速、今どう見る？,Kenのテスラ戦略ラボ,https://www.youtube.com/watch?v=QYm3lfHc8xo,✅ あり → 20260329_052329_QYm3lfHc8xo.md
株式,"2027 तक बेचना मत ( मालामाल हो जाओगे )| 1 Share : अभी भी मौका है, 40 के भाव में मिल रहा है",Analyst Sajan,https://www.youtube.com/watch?v=JRdHa_KA0Bs,✅ あり → 20260329_052439_JRdHa_KA0Bs.md
株式,あの利回り4 5％で実質累進配当の大手株を世界最大機関が爆買い,ゆるっとひげ株投資,https://www.youtube.com/watch?v=8Yl_pOgNhQo,✅ あり → 20260329_052534_8Yl_pOgNhQo.md
株式,この株達は絶対に売るな！暴落買い＋永久保有をおすすめする厳選５銘柄【2026最新版】,ひげづらの株式研究所,https://www.youtube.com/watch?v=Ax5_Q3cSjU8,⏭️ スキップ
株式,【3月29日】米国株が正式に調整局面入り。ダウとナスダック10%下落と中東緊迫による原油高,毎日聴く世界経済ニュース解説,https://www.youtube.com/watch?v=kxczadZF0LM,✅ あり → 20260329_053127_kxczadZF0LM.md
