keyword,title,channel,url,idea
株式,新NISAで狙うAI本命、藤倉8倍級の次に来る光半導体株とは #藤倉 #藤倉株価 #光半導体 #光半導体銘柄 #AIデータセンター #AI関連株,株式インサイト研究所,https://www.youtube.com/watch?v=-uOkduMn3SA,✅ あり → 20260510_073338_-uOkduMn3SA.md
株式,【上がる材料株！？】スクロールが超増配で夜間ストップ高、FIGがAI半導体材料で人気沸騰など！2026年5月8日（木）の日本株最新情報,お祈り株投資家フラム,https://www.youtube.com/watch?v=VVYkTWdNiCw,✅ あり → 20260510_073427_VVYkTWdNiCw.md
株式,【任天堂49%暴落】1308万株の「借金買い」が爆発寸前！？5月8日決算で起きる3つの衝撃シナリオを徹底解説【Switch2/新NISA】#任天堂 #株価予想 #Switch2,投資ナビJP,https://www.youtube.com/watch?v=94KeDNpm5xQ,⏭️ スキップ
株式,【あすの株相場】5月7日(木) 日経爆上げ過去最強 / 樹脂の光ケーブル新技術で東ソー期待上げ / 横河電機、増益見通しもコンセ不足か / 住友林業減益、米住宅不調 / 住友商事、バフェじいが買い,株の材料屋,https://www.youtube.com/watch?v=G_rH5-zpOaM,⏭️ スキップ
株式,[5/7]米国半導体に連動しSQ前に「日経5」市場最高値更新。まだ戦争終わってないのに株が上がりたがっている模様。コーニングNVIDIAと提携で電線系アゲアゲ。,視聴率の高い日本株を見るチャンネル,https://www.youtube.com/watch?v=xsYttXnI3n0,✅ あり → 20260510_073713_xsYttXnI3n0.md
株式,キオクシア株ストップ高の理由！今後の見通しとAI需要,5分トレンドニュース解説,https://www.youtube.com/watch?v=3IaYSpDvRsk,✅ あり → 20260510_073810_3IaYSpDvRsk.md
株式,【テンバガー候補】利益74%減でも株価爆上げ!? キオクシアの次に化ける「光電融合」最強3銘柄を徹底解説！#日本株 #新NISA #光電融合 #半導体 #株式投資 #投資初心者 #テンバガー,日経勝ち筋,https://www.youtube.com/watch?v=stQVhYg4aWU,⏭️ スキップ
株式,【中級者向け】未上場銘柄を今すぐ買う方法！（スペースＸ、オープンAI、アンソロピック）,”質問受付中”投資家【ある】のエヌビディア最前線,https://www.youtube.com/watch?v=yv_FsN-XJas,✅ あり → 20260510_074003_yv_FsN-XJas.md
株式,資産7億円の桐谷さん、長期保有の持ち株紹介「配当と優待だけで元は取ってます」,日本スコープ,https://www.youtube.com/watch?v=Aqc3O02g48o,✅ あり → 20260510_074042_Aqc3O02g48o.md
株式,見向きもされない低位株,たかひろ,https://www.youtube.com/watch?v=ccZrhHOGjYY,❌ なし
株式,株式投資 最新情報 5月7日の日本株｜日経平均が大幅高、なぜ？TOPIX・ドル円・半導体AIで相場振り返り,株のおつまみニュース,https://www.youtube.com/watch?v=ffiP0NObL2c,✅ あり → 20260510_074223_ffiP0NObL2c.md
株式,5/7【株式投資参謀本部】ついに来た大爆騰の日経平均株価/投資家たちの我慢の先に良い結果が出たー!!,株式投資参謀本部,https://www.youtube.com/watch?v=HvsTZ26feTE,❌ なし
株式,5.7夜ライブ🌉 20時スタート▶️ 金と銀はここからヤバイ上昇くるぞ！👊米国株投資🇺🇸,米国株ファンダメンタルズ分析家　まもる【米国株】【経済】,https://www.youtube.com/watch?v=Tp3u3Ow0kts,✅ あり → 20260510_074603_Tp3u3Ow0kts.md
株式,本日の寄り付き実況　（旧「今日の相場見通し」）　　－今日の気配銘柄は？－,Jean-Pierre Pyxis,https://www.youtube.com/watch?v=mI0DNyjhWko,❌ なし
株式,令和８年5月7日　日本株・・売り方を焼き尽くす・・長期投資家しか生き残らないのだ！,横浜ザイバツ ファンクラブ！,https://www.youtube.com/watch?v=_U_hibaCU_w,⏭️ スキップ
株式,5/7【大局相場の大チャンス】日本株の最新テクニカル分析！注目個別株８選のトレード戦略を徹底解説します【日経平均・フジクラ・JX金属・キオクシア・SBG・レーザー・アドバン・日東紡績・古河電工】,ニアの株チャート研究所,https://www.youtube.com/watch?v=mGsUofynpvY,✅ あり → 20260510_074813_mGsUofynpvY.md
株式,【5/7米国株 MAD MONEY】メディアの嘘に騙されるな！今すぐ買うべき急落バーゲン株3選,米国株投資 - ジム・クレイマー解説,https://www.youtube.com/watch?v=WysiE0eFy6o,✅ あり → 20260510_074859_WysiE0eFy6o.md
株式,【明日のテンバガー株】TSMC高値更新！日経63000突破！イビデン！メック！キオクシアホールディングス！S高！Terra Drone！乱高下！ASAHI EITO！堅調！【20260507】,テンバガー・高配当株発掘 - TMNTGAMER,https://www.youtube.com/watch?v=yuxQJ_SjUpI,❌ なし
株式,【増配確実⁉】本当は内緒にしたい…四季報で見つけた！お宝高配当株！【厳選10社】,日本マネー知識局,https://www.youtube.com/watch?v=MjSN8rstCDA,✅ あり → 20260510_075031_MjSN8rstCDA.md
株式,【北の株式投資大学】生配信オンライン講義2,【北の株式投資大学】official,https://www.youtube.com/watch?v=4q3FTzTkSQ0,❌ なし
株式,SBGストップ高　株探を読む　明日の株式相場　5/7,AiCAT　すぷらねこ,https://www.youtube.com/watch?v=rhEb3sZKbJg,✅ あり → 20260510_075214_rhEb3sZKbJg.md
株式,第88回：株式会社フリップザミント 久川 誠太朗さん　～消費を「思考のある選択」へ,あさ会話 ｜キャリアストーリーインタビュー,https://www.youtube.com/watch?v=0Wc5nhcWEC8,❌ なし
株式,最大級爆上げも成果いまいち！暴落半値銘柄も,カブ主優待ライダー,https://www.youtube.com/watch?v=_oueL_TWgMw,✅ あり → 20260510_075349__oueL_TWgMw.md
株式,【決算速報】日本ライフラインの決算を徹底分析,決算書分析チャンネル:テスト運用,https://www.youtube.com/watch?v=akbhDeycoFk,✅ あり → 20260510_075446_akbhDeycoFk.md
