keyword,title,channel,url,idea
株式,IFA(インディペンデント・ファイナンシャル・アドバイザー）の視点から本日の株式相場を解説,IFA法人　BIGTREE株式会社,https://www.youtube.com/watch?v=H38LaWgc_lA,⏭️ スキップ
株式,今日の活況銘柄を見ていく！（キオクシア・フジクラ・SBG・ACSL・アドバンテスト等）株式テクニカルチャート分析,トレーダーTOMO,https://www.youtube.com/watch?v=OZI2XzMeKC0,⏭️ スキップ
株式,これだけでOK 【デイトレ入門】 勝株アセットのデイトレ テクニック,勝株アセットの株TV【SEK】,https://www.youtube.com/watch?v=cDFLe5G8Hzw,⏭️ スキップ
株式,「入社前に聞けばよかった、全部話す。」株式会社ダイコー 東京営業所長・川島さん,採用を、変える人たち。by REVERENT FIRST 採用コンサルティング,https://www.youtube.com/watch?v=J7iQ7AaWziE,⏭️ スキップ
株式,"日本宇宙战略：从海底电缆转向“星际通信网”告别海底电缆？NTT与JAXA的生存级宇宙布局 #日経平均株価, #株式投資, #日本株，#スペースコンパス, #IOWN,",円キャリーの狩人たち,https://www.youtube.com/watch?v=SUIEbWUiZP8,✅ あり → 20260427_063023_SUIEbWUiZP8.md
株式,SBIグローバルアセットマネジメント株式会社  2026年3月期 通期決算説明会,SBIグローバルアセットマネジメント【公式】,https://www.youtube.com/watch?v=HJi9NWtj7wk,❌ なし
株式,【実録】暴落で「逃げろ」の大合唱に騙された投資家の末路。31営業日後の残酷な格差。#投資 #株式投資 #米国株 #S&amp;P500 #新NISA #資産形成 #暴落 #カブヨミ#イラン危機 #日経平均,カブヨミ,https://www.youtube.com/watch?v=rk-hyqMHzwc,✅ あり → 20260427_063252_rk-hyqMHzwc.md
株式,質問回米国株とゴールドの見通し暴落高騰シナリオと投資戦略をお答えします,株式マネー最前線,https://www.youtube.com/watch?v=RBBXGDVrATY,✅ あり → 20260427_063325_RBBXGDVrATY.md
株式,【米国株】「割安銘柄を狙え」数字から導き出す買場を徹底分析！,”質問受付中”投資家【ある】のエヌビディア最前線,https://www.youtube.com/watch?v=rY5rJ2MdmPk,✅ あり → 20260427_063423_rY5rJ2MdmPk.md
株式,お宝銘柄を探してみよう　第8回,my株・株マップ【公式】,https://www.youtube.com/watch?v=SW9-66fN3wg,✅ あり → 20260427_063545_SW9-66fN3wg.md
株式,日経平均6万円の「真っ赤な嘘」…トヨタ暴落と252銘柄安値更新が示す、地獄のK字型相場の正体！#日経平均 #日本株 #トヨタ #半導体株 #投資信託 #株式投資 #新NISA,日本财経ネットワーク,https://www.youtube.com/watch?v=ew2CJl381ZA,⏭️ スキップ
株式,【米国株グロース株調査】DNAの次はたんぱく質解析、その大衆化を狙うベンチトップ型解析企業「Quantum-Si（クアンタム・シイ）」【元金融マンの投資初心者アニメ】,中高年の投資初心者向けアニメ,https://www.youtube.com/watch?v=qJIySWBeins,✅ あり → 20260427_063750_qJIySWBeins.md
株式,日経平均6万円の「嘘」…史上最大のエネルギー危機で資産が溶ける？今すぐ逃げるべき銘柄、持つべき銘柄#日経平均  #株式投資 #日本株 日本株 #半導体,投資の教科書,https://www.youtube.com/watch?v=L8IJo7vCKI4,✅ あり → 20260427_063853_L8IJo7vCKI4.md
株式,日経平均が上がっている今だからこそ次の暴落で絶対に買い増ししたい、最強の景気耐性銘柄6選を一挙公開します【ゆっくり解説】,たくやの投資チャンネル,https://www.youtube.com/watch?v=u3cN-Ss6qVY,✅ あり → 20260427_064018_u3cN-Ss6qVY.md
株式,【第238回】マステアの株デイトレ配信 2026 04/24,マステアのデイトレ配信,https://www.youtube.com/watch?v=Urs0isZeetU,⏭️ スキップ
株式,【株価下落】バーゲンセール開始と重要な注意S P500 FANG+ NASDAQ100 オルカン,ハル【資産を10倍にする投資】,https://www.youtube.com/watch?v=EWTkMJv9XDQ,✅ あり → 20260427_064350_EWTkMJv9XDQ.md
株式,総利回り１０％で最強クラスの新設株主優待銘柄４選！,Ana Laura Ferreira Scherer,https://www.youtube.com/watch?v=b0G-0pzmc60,✅ あり → 20260427_064457_b0G-0pzmc60.md
株式,【デイトレライブ】金曜後場！日経平均60000はまぼろし～～～！？【投資/株式投資/LIVE/配信/雑談/デイトレード】　#だてこさん,だてこのぴよぴよデイトレ,https://www.youtube.com/watch?v=vX-LZ8gjt1g,⏭️ スキップ
株式,【累計235万勝ち】バリュー株が今日も全面安・・・厳しい相場だなぁ【4/24　後場デイトレード放送】,お祈り株投資家フラム,https://www.youtube.com/watch?v=2L4jnUGrlsw,⏭️ スキップ
株式,西山孝四郎のマーケットスクエア  2026年4月24日,西山孝四郎のマーケットスクエア,https://www.youtube.com/watch?v=MqmEyEvLd-s,✅ あり → 20260427_064848_MqmEyEvLd-s.md
株式,【緊急警告】株が終わる日が来た…銀価格はどこまで上がるのか？“謎の買い手”と資金大移動で始まる歴史的爆騰の前夜【2026】,グローバル資産分析,https://www.youtube.com/watch?v=RHYGnvZ5XN4,✅ あり → 20260427_065001_RHYGnvZ5XN4.md
株式,まさかの暴落か、それとも歴史的転換か――株式市場に異変が迫っている【成功法則 お金】・【投資初心者】・【投資戦略】,成功法則 お金,https://www.youtube.com/watch?v=0qn6BQByGyY,✅ あり → 20260427_065124_0qn6BQByGyY.md
株式,6万円相場で勝つ人は何が違うのか、負け組を分ける6つの落とし穴#日経平均 #日経平均6万円 #日本株 #株式投資 #個人投資家,東京マーケット羅針盤,https://www.youtube.com/watch?v=VUA3ds3LUuI,⏭️ スキップ
株式,S&amp;P500株価最高値更新中だが投資は継続して良いのか？【NASDAQ100.オルカン】,ちひろ社長〜サイドFIREのススメ〜,https://www.youtube.com/watch?v=gocMkYkUW58,⏭️ スキップ
